{
  "manifestVersion": "1.0",
  "name": "Technology",
  "displayName": "Technology Pack",
  "description": "Optional pack for product, engineering, release, documentation, and developer-community publishing.",
  "version": "0.1.0",
  "requiresCore": "0.1.0",
  "registers": { "contentTypes": true, "datasets": true, "rules": true, "templates": true, "dashboardCards": true, "seedData": true },
  "resources": {
    "contentTypes": ["content-types/catalog.json"], "datasets": ["datasets/catalog.json"], "rules": ["rules/publishing.json"],
    "templates": ["templates/pages.json"], "dashboardCards": ["dashboard-cards/cards.json"], "seedData": ["seed-data/sample.json"]
  }
}
